{
  "id": "smackdown-2026-04-25",
  "show": "SmackDown",
  "date": "2026-04-25",
  "venue": "Fort Worth, Texas (Von Erich territory, World Class roots)",
  "context": "First SmackDown after WrestleMania 42. Post-Mania draft/shuffle energy. Texas crowds carry generational wrestling memory.",
  "segments": [
    {
      "id": "smackdown-2026-04-25-seg-01",
      "type": "backstage",
      "position": "cold-open",
      "carriers": ["cody-rhodes", "trick-williams", "lil-yachty", "danhausen"],
      "threads_advanced": ["cody-third-reign", "trick-us-title-reign", "danhausen-sacred-clown-arc"],
      "threads_opened": [],
      "threads_closed": [],
      "threads_transformed": [],
      "outcome": "Backstage arrivals. Cody (broken orbital) arrives as champion. Trick + Lil Yachty arrive (rapper attached). Danhausen in scene.",
      "stand_tall": "none",
      "register": "Pantheon",
      "notes": "Locker-room census. Institution shows who's load-bearing."
    },
    {
      "id": "smackdown-2026-04-25-seg-02",
      "type": "promo",
      "position": "A-block",
      "carriers": ["jacob-fatu"],
      "threads_advanced": ["roman-vs-fatu-whc", "fatu-physical-arrival-raw"],
      "threads_opened": ["roman-vs-fatu-whc", "fatu-physical-arrival-raw"],
      "threads_closed": [],
      "threads_transformed": [],
      "outcome": "Fatu opens in-arena. (Detail not logged in markdown — structurally the opening shot of the WHC challenger.)",
      "stand_tall": "heel",
      "register": "Pantheon",
      "notes": "Power position to Fatu — first show after WM42, free-agent aitu."
    },
    {
      "id": "smackdown-2026-04-25-seg-03",
      "type": "backstage",
      "position": "A-block",
      "carriers": ["kathy-kelley", "giulia", "kiana-james"],
      "threads_advanced": [],
      "threads_opened": ["kiana-giulia-pipeline"],
      "threads_closed": [],
      "threads_transformed": [],
      "outcome": "Giulia vs Tiffany announced. Kiana 'us' language but blamed Kathy for tension. Ally-to-challenger pipeline begins.",
      "stand_tall": "none",
      "register": "Constant",
      "notes": "Joe's prediction logged: Kiana turns within 2 months. Giulia roster note: half-Japanese, half-Italian — syncretic."
    },
    {
      "id": "smackdown-2026-04-25-seg-04",
      "type": "match",
      "position": "A-block",
      "carriers": ["giulia", "tiffany-stratton", "kiana-james"],
      "threads_advanced": ["kiana-giulia-pipeline"],
      "threads_opened": ["tiffany-women-us-reign"],
      "threads_closed": [],
      "threads_transformed": [],
      "outcome": "Tiffany Stratton def. Giulia (Women's US Title) clean. Kiana's interference attempt failed. Stratton kissed bicep — Hogan/Papa Pump energy.",
      "stand_tall": "heel",
      "register": "Pantheon",
      "notes": "Kiana showed her hand. Pipeline accelerated by visible-failure."
    },
    {
      "id": "smackdown-2026-04-25-seg-05",
      "type": "promo",
      "position": "B-block",
      "carriers": ["paige", "brie-bella"],
      "threads_advanced": ["inanna-paige-return", "womens-tag-reign-paige-brie"],
      "threads_opened": [],
      "threads_closed": [],
      "threads_transformed": [],
      "outcome": "Brie led 'welcome back' chant for Paige. Reign establishment promo.",
      "stand_tall": "babyface",
      "register": "Pantheon",
      "notes": "Inanna's return received with conscious gratitude. Bellas as gatekeepers who opened the underworld door."
    },
    {
      "id": "smackdown-2026-04-25-seg-06",
      "type": "match",
      "position": "B-block",
      "carriers": ["charlotte-flair", "alexa-bliss", "paige", "brie-bella", "jacy-jayne", "fallon-henley"],
      "threads_advanced": ["charlotte-alexa-partnership", "womens-tag-reign-paige-brie"],
      "threads_opened": ["fatal-influence-arc"],
      "threads_closed": [],
      "threads_transformed": [],
      "outcome": "Charlotte/Alexa vs Paige/Brie ended DQ — Fatal Influence (Jacy + Fallon) interfered, attacked both teams. Paige/Brie retain.",
      "stand_tall": "heel",
      "register": "Constant",
      "notes": "NXT call-up debut. 'Taking over SmackDown' announced. YES YES YES chant for Brie (Danielson by proxy). Lexi/Ashley at zero-gimmick — transparency-potency live."
    },
    {
      "id": "smackdown-2026-04-25-seg-07",
      "type": "match",
      "position": "B-block",
      "carriers": ["damian-priest", "r-truth", "tama-tonga", "talla-tonga", "solo-sikoa"],
      "threads_advanced": ["mfts-collapse"],
      "threads_opened": ["anubis-thoth-judgment"],
      "threads_closed": [],
      "threads_transformed": [],
      "outcome": "Priest & R-Truth def. MFTs clean. Pin on the biggest MFT member (Talla). Anubis passed judgment on the war-cult.",
      "stand_tall": "babyface",
      "register": "Pantheon",
      "notes": "MFT enforcer pinned clean = signal 'we're moving on'. War-cult collapsing in real time."
    },
    {
      "id": "smackdown-2026-04-25-seg-08",
      "type": "backstage",
      "position": "B-block",
      "carriers": ["sami-zayn", "trick-williams", "lil-yachty", "the-miz", "danhausen"],
      "threads_advanced": [],
      "threads_opened": ["sami-descent-arc", "trick-vs-sami-backlash", "gingerbread-shadow-real"],
      "threads_closed": [],
      "threads_transformed": [],
      "outcome": "Miz + Danhausen vignette → Trick + Yachty scene. Gingerbread mascot breaks out and attacks. Sami inside the costume — laid Trick out. No promo.",
      "stand_tall": "heel",
      "register": "Pantheon",
      "notes": "Trojan horse: Sami used Sacred Clown's comedy register as cover. Predecessor descent begins. WM42 callback — Trick beat Sami for US title."
    },
    {
      "id": "smackdown-2026-04-25-seg-09",
      "type": "promo",
      "position": "B-block",
      "carriers": ["cody-rhodes"],
      "threads_advanced": ["cody-third-reign"],
      "threads_opened": [],
      "threads_closed": [],
      "threads_transformed": [],
      "outcome": "Champion with the black eye. 'I always get back up' — property-frame, not moment-frame. Crowd approved.",
      "stand_tall": "babyface",
      "register": "Pantheon",
      "notes": "Wound is the credential, not the liability. Fatal Influence replay aired during segment."
    },
    {
      "id": "smackdown-2026-04-25-seg-10",
      "type": "backstage",
      "position": "B-block",
      "carriers": ["solo-sikoa", "royce-keys"],
      "threads_advanced": ["mfts-collapse", "royce-keys-liminal-warrior-arc"],
      "threads_opened": ["royce-keys-liminal-warrior-arc"],
      "threads_closed": [],
      "threads_transformed": [],
      "outcome": "Solo approached Royce Keys (Andre BR winner). Chief-usurper reasserting dominance after MFT implosion. Match TBD.",
      "stand_tall": "none",
      "register": "Constant",
      "notes": "Recruitment opener. The anointed-unknown gets institutional attention."
    },
    {
      "id": "smackdown-2026-04-25-seg-11",
      "type": "match",
      "position": "B-block",
      "carriers": ["danhausen", "the-miz", "kit-wilson"],
      "threads_advanced": ["danhausen-sacred-clown-arc"],
      "threads_opened": ["danhausen-vs-miz-wilson"],
      "threads_closed": [],
      "threads_transformed": [],
      "outcome": "Danhausen def. Miz. Finish: Undertaker sit-up → 'You are cursed' → laugh → win. Kit Wilson with Miz — succession pipeline noted.",
      "stand_tall": "babyface",
      "register": "Constant",
      "notes": "Sacred Clown quoting departed mythology through comedy register. Transparency-potency in three moves."
    },
    {
      "id": "smackdown-2026-04-25-seg-12",
      "type": "match",
      "position": "B-block",
      "carriers": ["rhea-ripley", "jacy-jayne", "fallon-henley", "lainey-reid"],
      "threads_advanced": ["fatal-influence-arc", "jade-vs-rhea-rematch"],
      "threads_opened": [],
      "threads_closed": [],
      "threads_transformed": [],
      "outcome": "Rhea wins by DQ — Fatal Influence interference (second DQ of the night for them).",
      "stand_tall": "heel",
      "register": "Pantheon",
      "notes": "Macha didn't lose, but was swarmed. FI's main-roster identity: can prevent a clean night."
    },
    {
      "id": "smackdown-2026-04-25-seg-13",
      "type": "match",
      "position": "main-event",
      "carriers": ["jacob-fatu", "solo-sikoa", "tama-tonga", "jimmy-uso", "jey-uso"],
      "threads_advanced": ["roman-vs-fatu-whc", "mfts-collapse", "tama-tonga-restless", "fatu-physical-arrival-raw"],
      "threads_opened": [],
      "threads_closed": [],
      "threads_transformed": [],
      "outcome": "Fatu def. Solo clean. Pre-match: Tama mic-grab from Solo, Fatu superkicked Tama. Post-match: Fatu beat the entire MFT faction. Usos watched from apron. Fatu to Usos: 'I see y'all on Raw'.",
      "stand_tall": "heel",
      "register": "Pantheon",
      "notes": "Free-agent aitu beat the chief clean. MFTs functionally dead. Cross-brand declaration — declares for Raw."
    }
  ]
}
