{
  "id": "raw-2026-04-27",
  "show": "Raw",
  "date": "2026-04-27",
  "venue": "Sames Auto Arena, Laredo, Texas",
  "context": "Border city, 95%+ Hispanic, closer to Monterrey than San Antonio. Lucha country (Penta's home). Hendry's culture test. Fatu's first Raw appearance.",
  "segments": [
    {
      "id": "raw-2026-04-27-seg-01",
      "type": "video",
      "position": "cold-open",
      "carriers": ["roman-reigns", "jimmy-uso", "jey-uso"],
      "threads_advanced": ["bloodline-civil-war", "roman-vs-fatu-whc"],
      "threads_opened": [],
      "threads_closed": [],
      "threads_transformed": [],
      "outcome": "Pre-taped package. Dark room war council. Roman + Usos. 'The first family' — fourth-wall camera look. Hard cut to Fatu.",
      "stand_tall": "babyface",
      "register": "Pantheon",
      "notes": "Worked-shoot register; meta-kayfabe obligation activated. Power-position opener = Roman is THE program."
    },
    {
      "id": "raw-2026-04-27-seg-02",
      "type": "promo",
      "position": "A-block",
      "carriers": ["seth-rollins", "bron-breakker", "paul-heyman"],
      "threads_advanced": ["bron-vs-seth-2026", "vision-faction", "rollins-lone-wolf-arc"],
      "threads_opened": [],
      "threads_closed": [],
      "threads_transformed": [],
      "outcome": "Seth in all black, said his piece. Heyman silent — passed mic to Bron. Bron: 'You got nothing... I needed him [Heyman].' Seth granted Backlash match. Crowd singing for Seth.",
      "stand_tall": "babyface",
      "register": "Pantheon",
      "notes": "Heyman silence diagnostic — testing Bron solo or keeping powder dry. Bron admitting dependence while mocking isolation. Seth is the granter, not the requester — agency with the lone wolf."
    },
    {
      "id": "raw-2026-04-27-seg-03",
      "type": "backstage",
      "position": "A-block",
      "carriers": ["raquel-rodriguez", "liv-morgan", "stephanie-vaquer"],
      "threads_advanced": ["jd-coven"],
      "threads_opened": ["vaquer-injury-writeoff"],
      "threads_closed": [],
      "threads_transformed": [],
      "outcome": "Raquel cheap shot on Vaquer backstage. Liv leading. Full JD women's faction wipeout on Vaquer.",
      "stand_tall": "heel",
      "register": "Constant",
      "notes": "Legit AC sprain — written off indefinitely."
    },
    {
      "id": "raw-2026-04-27-seg-04",
      "type": "match",
      "position": "B-block",
      "carriers": ["penta", "jevon-evans", "ethan-page", "rusev"],
      "threads_advanced": [],
      "threads_opened": [],
      "threads_closed": [],
      "threads_transformed": [],
      "outcome": "Penta + Je'Von vs opponents (TBD from recap). Match transitioned to Page + Rusev staredown ringside.",
      "stand_tall": "none",
      "register": "Constant",
      "notes": "Hulk Hogan 'Real American' desk promo aside — pharmacy giving itself medicine."
    },
    {
      "id": "raw-2026-04-27-seg-05",
      "type": "backstage",
      "position": "B-block",
      "carriers": ["chad-gable", "rey-mysterio"],
      "threads_advanced": [],
      "threads_opened": ["el-grande-americano-mask-feud"],
      "threads_closed": [],
      "threads_transformed": [],
      "outcome": "Chad Gable fully gone — this is OG El Grande Americano now. Rey backstage, calling him 'Mr OG Grande Americano'.",
      "stand_tall": "none",
      "register": "Constant",
      "notes": "Rey overcasting the character shift. Selling it too hard."
    },
    {
      "id": "raw-2026-04-27-seg-06",
      "type": "match",
      "position": "B-block",
      "carriers": ["becky-lynch", "iyo-sky", "asuka", "adam-pearce"],
      "threads_advanced": ["becky-nemesis-arc"],
      "threads_opened": ["becky-vs-iyo-precursor"],
      "threads_closed": [],
      "threads_transformed": [],
      "outcome": "Becky goaded IYO via Rhea-history wound; IYO attacked, Becky slipped out, Pearce made it a match. Becky wins — Asuka interference robbed IYO.",
      "stand_tall": "heel",
      "register": "Pantheon",
      "notes": "Nemesis controlled the full sequence. Asuka interference set up Backlash collision."
    },
    {
      "id": "raw-2026-04-27-seg-07",
      "type": "match",
      "position": "B-block",
      "carriers": ["joe-hendry", "logan-paul", "austin-theory", "montez-ford", "angelo-dawkins"],
      "threads_advanced": ["hendry-orphic-bard", "vision-faction"],
      "threads_opened": ["street-profits-hendry-alliance"],
      "threads_closed": [],
      "threads_transformed": [],
      "outcome": "Hendry concert — solid Laredo pop. Song morphed to 'Paul, Paul, can we fire Logan Paul'. Drew out Logan + Theory; 2-on-1 beatdown. Profits made the save. ~75% crowd singalong.",
      "stand_tall": "babyface",
      "register": "Liminal-Warrior",
      "notes": "Orphic proof in border city. The instrument travels. Profits + Hendry alliance forming."
    },
    {
      "id": "raw-2026-04-27-seg-08",
      "type": "match",
      "position": "B-block",
      "carriers": ["rey-mysterio", "chad-gable", "ludwig-kaiser"],
      "threads_advanced": [],
      "threads_opened": [],
      "threads_closed": [],
      "threads_transformed": [],
      "outcome": "Rey def. Kaiser-El-Grande-Americano via 619 after OG Gable intervened to stop Kaiser using metal plate.",
      "stand_tall": "babyface",
      "register": "Constant",
      "notes": "Double-corrective — lucha cemented in WWE; lucha's inclusivity correcting institutional exclusion. Mask checks commitment, not ethnicity."
    },
    {
      "id": "raw-2026-04-27-seg-09",
      "type": "match",
      "position": "B-block",
      "carriers": ["oba-femi", "greyson-waller"],
      "threads_advanced": ["oba-ascension-streak"],
      "threads_opened": [],
      "threads_closed": [],
      "threads_transformed": [],
      "outcome": "Oba squashed Waller (who'd complained about no opportunities). Open challenge on the mic post-match. 'Anyone who wants to climb the mountain can step up.'",
      "stand_tall": "heel",
      "register": "Pantheon",
      "notes": "Ascending orisha breaks silence with generosity, not rage. Sovereign behavior — the mountain doesn't chase you, but invites."
    },
    {
      "id": "raw-2026-04-27-seg-10",
      "type": "promo",
      "position": "B-block",
      "carriers": ["iyo-sky", "asuka"],
      "threads_advanced": ["asuka-onryo-register"],
      "threads_opened": ["asuka-vs-iyo-backlash"],
      "threads_closed": [],
      "threads_transformed": [],
      "outcome": "IYO + Asuka promo — Backlash match made official.",
      "stand_tall": "none",
      "register": "Pantheon",
      "notes": "The Onryō who robbed IYO in S6 now gets the formal collision. Self-correcting pressure venues."
    },
    {
      "id": "raw-2026-04-27-seg-11",
      "type": "match",
      "position": "B-block",
      "carriers": ["liv-morgan", "roxanne-perez", "finn-balor", "bayley", "lyra-valkyria", "raquel-rodriguez"],
      "threads_advanced": ["jd-coven", "balor-fomorian-exile", "lyra-vs-jd"],
      "threads_opened": ["roxanne-loyalty-test"],
      "threads_closed": [],
      "threads_transformed": [],
      "outcome": "Backstage: Liv 'my little Roxy' / Finn warns Roxanne. Match: Bayley + Lyra vs Raquel + Roxanne. Liv distraction at ringside, Roxanne capitalized for the win.",
      "stand_tall": "heel",
      "register": "Constant",
      "notes": "Three layers of manipulation. Roxanne the hinge. JD coven functional short-term despite fracture seeds."
    },
    {
      "id": "raw-2026-04-27-seg-12",
      "type": "promo",
      "position": "main-event",
      "carriers": ["roman-reigns", "jacob-fatu"],
      "threads_advanced": ["roman-vs-fatu-whc", "fatu-physical-arrival-raw", "bloodline-civil-war"],
      "threads_opened": ["tongan-death-grip-taboo"],
      "threads_closed": [],
      "threads_transformed": [],
      "outcome": "Roman closer. OTC chants. 'I run this place.' Couldn't finish saying 'nepotism' — Fatu cut it off physically. Mandible claw on Roman, choked him down. Picked up belt, threw it at Roman. 'I'm not waiting till Backlash — I'll see you next week on Monday.' Roman gave the match. Roman ended genuinely shook.",
      "stand_tall": "heel",
      "register": "Pantheon",
      "notes": "Roman owns BOTH power positions but lost sovereignty by close. Fatu violated the architecture. Belt rejected — wants the throne, not the accessory. Tongan Death Grip first deployed against Roman."
    }
  ]
}
