{
  "id": "smackdown-2026-05-01",
  "show": "SmackDown",
  "date": "2026-05-01",
  "venue": "BOK Center, Tulsa, Oklahoma (Jim Ross territory; old-school workrate-respect crowd)",
  "context": "Tulsa = JR country. Crowd respects ring psychology and promo work. Show partially logged — second half not captured (Hulu temporal mismatch). Cody-Gunther feud opens here.",
  "segments": [
    {
      "id": "smackdown-2026-05-01-seg-01",
      "type": "promo",
      "position": "cold-open",
      "carriers": ["jacob-fatu"],
      "threads_advanced": ["roman-vs-fatu-whc", "fatu-physical-arrival-raw"],
      "threads_opened": [],
      "threads_closed": [],
      "threads_transformed": [],
      "outcome": "Video package recap. Fatu makes his way to the BOK Center — opens SmackDown. Tongan Deathclip framed as his own submission.",
      "stand_tall": "heel",
      "register": "Pantheon",
      "notes": "Fatu owns opening segment on BOTH brands consecutive weeks. Free-agent aitu — booking confirms cross-brand priority."
    },
    {
      "id": "smackdown-2026-05-01-seg-02",
      "type": "promo",
      "position": "A-block",
      "carriers": ["cody-rhodes", "ricky-saints"],
      "threads_advanced": ["cody-third-reign"],
      "threads_opened": ["ricky-saints-debut-arc"],
      "threads_closed": [],
      "threads_transformed": [],
      "outcome": "Cody declares cleared for action; floats open challenge. Ricky Saints interrupts — main-roster debut. Saints: 'I came to change who the show is about.' Match made.",
      "stand_tall": "none",
      "register": "Pantheon",
      "notes": "~15% recognized Saints' entrance. Self-coronation in another man's kingdom triggered crowd's 'Cody' chant — immune response. False savior placement."
    },
    {
      "id": "smackdown-2026-05-01-seg-03",
      "type": "promo",
      "position": "A-block",
      "carriers": ["rhea-ripley", "charlotte-flair", "alexa-bliss"],
      "threads_advanced": ["charlotte-alexa-partnership", "fatal-influence-arc", "jade-vs-rhea-rematch"],
      "threads_opened": [],
      "threads_closed": [],
      "threads_transformed": [],
      "outcome": "Replay: Rhea vs Jacy (4/25). Charlotte + Alexa partnership holding. Rhea offers third — Charlotte rejects. 3-way announced: Rhea vs Alexa vs Charlotte (later show).",
      "stand_tall": "none",
      "register": "Pantheon",
      "notes": "Charlotte's pride refusing the sovereign's help. Alexa caught in middle."
    },
    {
      "id": "smackdown-2026-05-01-seg-04",
      "type": "match",
      "position": "B-block",
      "carriers": ["charlotte-flair", "jacy-jayne", "fallon-henley", "alexa-bliss", "rhea-ripley"],
      "threads_advanced": ["fatal-influence-arc", "charlotte-alexa-partnership", "jade-vs-rhea-rematch"],
      "threads_opened": [],
      "threads_closed": [],
      "threads_transformed": [],
      "outcome": "Charlotte vs Jacy. Charlotte ~80% Euro-style chant. Fallon interference; Alexa assist not enough. Jacy wins via Rolling Encore. Post-match FI beatdown; Rhea answered the crowd's call, cleared house. Charlotte handshake-equal with Rhea to close.",
      "stand_tall": "babyface",
      "register": "Pantheon",
      "notes": "FI gets first clean-ish win on SD — escalation from 4/25 DQs. Charlotte's pride cost her; humility opened the alliance. Macha's kingdom — handshake as equals."
    },
    {
      "id": "smackdown-2026-05-01-seg-05",
      "type": "backstage",
      "position": "B-block",
      "carriers": ["paige", "brie-bella", "byron-saxton"],
      "threads_advanced": ["inanna-paige-return", "womens-tag-reign-paige-brie"],
      "threads_opened": [],
      "threads_closed": [],
      "threads_transformed": [],
      "outcome": "Light segment. Brie + Paige with Byron — 'we're here to do the thing'. Reign establishment.",
      "stand_tall": "none",
      "register": "Constant"
    },
    {
      "id": "smackdown-2026-05-01-seg-06",
      "type": "backstage",
      "position": "B-block",
      "carriers": ["damian-priest", "r-truth", "axiom", "nathan-frazer"],
      "threads_advanced": ["anubis-thoth-judgment"],
      "threads_opened": [],
      "threads_closed": [],
      "threads_transformed": [],
      "outcome": "Priest + Truth approached Fraxiom. Damian offered match. Truth: 'taxes... what?' Comedy on Thoth's surface-misread.",
      "stand_tall": "none",
      "register": "Constant",
      "notes": "Recorder of truth misreads surface but stays in the right place."
    },
    {
      "id": "smackdown-2026-05-01-seg-07",
      "type": "backstage",
      "position": "B-block",
      "carriers": ["danhausen", "the-miz", "kit-wilson"],
      "threads_advanced": ["danhausen-sacred-clown-arc", "danhausen-vs-miz-wilson"],
      "threads_opened": [],
      "threads_closed": [],
      "threads_transformed": [],
      "outcome": "Miz + Wilson set trap. Danhausen: 'Falling into a trap for $400' — named the mechanism, walked away. Trap punished the trappers.",
      "stand_tall": "babyface",
      "register": "Constant",
      "notes": "Heyoka identified the trap, refused, and the trap punished its setters. Sacred Clown's presence is enough."
    },
    {
      "id": "smackdown-2026-05-01-seg-08",
      "type": "match",
      "position": "B-block",
      "carriers": ["damian-priest", "r-truth", "axiom", "nathan-frazer", "tama-tonga", "solo-sikoa"],
      "threads_advanced": ["anubis-thoth-judgment", "mfts-collapse"],
      "threads_opened": [],
      "threads_closed": [],
      "threads_transformed": [],
      "outcome": "Priest & Truth def. Fraxiom. Damian one-man-showed the finish. Post-match: Tama + Solo appear. Solo waved goodbye — challenge laid.",
      "stand_tall": "babyface",
      "register": "Constant",
      "notes": "Anubis rendered judgment alone. Solo can't challenge up after Fatu — challenges laterally."
    },
    {
      "id": "smackdown-2026-05-01-seg-09",
      "type": "promo",
      "position": "B-block",
      "carriers": ["solo-sikoa", "talla-tonga", "jimmy-uso", "jey-uso"],
      "threads_advanced": ["mfts-collapse", "bloodline-civil-war"],
      "threads_opened": ["tongan-death-grip-taboo"],
      "threads_closed": [],
      "threads_transformed": [],
      "outcome": "Solo + Talla in ring. 'You are a dead man walking' (Undertaker cadence). Usos music hits. Jey: 'That move [TDG] is last resort.' The Tongan Deathclip = sacred technique. Solo: 'You tell Roman that he ain't my tribal chief.'",
      "stand_tall": "heel",
      "register": "Pantheon",
      "notes": "Three declarations: TDG violated, Solo rejects Roman's authority, Solo wants Fatu dead. Family has a constitution; Fatu broke it."
    },
    {
      "id": "smackdown-2026-05-01-seg-10",
      "type": "backstage",
      "position": "B-block",
      "carriers": ["cody-rhodes", "sami-zayn"],
      "threads_advanced": ["sami-descent-arc", "trick-vs-sami-backlash", "cody-third-reign"],
      "threads_opened": [],
      "threads_closed": [],
      "threads_transformed": [],
      "outcome": "Sami trying to stay in Cody's orbit. Cody explicit: 'We are not the same.' Babyface tribe closed its door on the descending predecessor.",
      "stand_tall": "none",
      "register": "Pantheon",
      "notes": "Cody draws the line. Sami sees the descent even if Sami won't name it. Danhausen aside: 'uncursed the Knicks.'"
    },
    {
      "id": "smackdown-2026-05-01-seg-11",
      "type": "match",
      "position": "main-event",
      "carriers": ["cody-rhodes", "ricky-saints"],
      "threads_advanced": ["cody-third-reign", "ricky-saints-debut-arc"],
      "threads_opened": [],
      "threads_closed": [],
      "threads_transformed": [],
      "outcome": "Cody def. Ricky Saints via Cross Rhodes — clean but earned. Saints brought AEW ring style, forced Cody to dig deep. Crowd: third Euro-style chant of the night for Cody.",
      "stand_tall": "babyface",
      "register": "Pantheon",
      "notes": "Saints made by losing — placement carried it. AEW register translated live."
    },
    {
      "id": "smackdown-2026-05-01-seg-12",
      "type": "angle",
      "position": "main-event",
      "carriers": ["gunther", "cody-rhodes"],
      "threads_advanced": [],
      "threads_opened": ["cody-vs-gunther-2026"],
      "threads_closed": [],
      "threads_transformed": [],
      "outcome": "Post-Cody/Saints: Gunther immediately attacks. Sleeper hold on depleted Cody — refs can't stop him. Gunther repositioned the belt over the unconscious champion. Crowd: 'You suck.'",
      "stand_tall": "heel",
      "register": "Pantheon",
      "notes": "Predator timing — attacked the wounded king after a fight, not before. Cody-Gunther Backlash program opened. Show closes on Gunther over Cody."
    }
  ]
}
